{"schema":"skalary/review-manifest@1","runId":"fda8da1a-0347-4cca-842b-0e90931fbfa4","state":"published","planDigest":"sha256:9b9029c4e3d92c65880b53a518b78f6a6f7e44afd89f60c413e5672432b0976c","runDigest":"sha256:6f534869e9e04c51775d715817926d409b42cb3829d820bab3b2895e8fbf0c4c","files":{"plan":{"name":"review-plan.9b9029c4e3d92c65880b53a518b78f6a6f7e44afd89f60c413e5672432b0976c.json","digest":"sha256:9b9029c4e3d92c65880b53a518b78f6a6f7e44afd89f60c413e5672432b0976c","bytes":1807},"canonical":{"name":"review-run.6f534869e9e04c51775d715817926d409b42cb3829d820bab3b2895e8fbf0c4c.json","digest":"sha256:6f534869e9e04c51775d715817926d409b42cb3829d820bab3b2895e8fbf0c4c","bytes":2215},"summary":{"name":"review-summary.45918959f0cb7a7be9f05537cae10f8b2a258c11ec61876ccb8cc4703114c663.md","digest":"sha256:45918959f0cb7a7be9f05537cae10f8b2a258c11ec61876ccb8cc4703114c663","bytes":820},"full":{"name":"review-full.bd4ea19445341397085719ac09fe9ce5375f8616cdbd4b62c0560ebcf518e975.md","digest":"sha256:bd4ea19445341397085719ac09fe9ce5375f8616cdbd4b62c0560ebcf518e975","bytes":2394}}}
