{"schema":"skalary/review-manifest@1","runId":"ca47ce29-3004-46e8-9687-e946ad052656","state":"published","planDigest":"sha256:b17acf91263445302905992c9851519918ffe68274b37fee2af157e3b626ab7f","runDigest":"sha256:c50e37257530eadf91b9be2268a2bef531529418b9140543a05bef53f9545379","files":{"plan":{"name":"review-plan.b17acf91263445302905992c9851519918ffe68274b37fee2af157e3b626ab7f.json","digest":"sha256:b17acf91263445302905992c9851519918ffe68274b37fee2af157e3b626ab7f","bytes":1744},"canonical":{"name":"review-run.c50e37257530eadf91b9be2268a2bef531529418b9140543a05bef53f9545379.json","digest":"sha256:c50e37257530eadf91b9be2268a2bef531529418b9140543a05bef53f9545379","bytes":37497},"summary":{"name":"review-summary.c6f675221fd7b2ee9cab9340acaa904207826b919635a3b269cf1fe1518d7481.md","digest":"sha256:c6f675221fd7b2ee9cab9340acaa904207826b919635a3b269cf1fe1518d7481","bytes":5429},"full":{"name":"review-full.1675f8855b6b9a2b7b0b64bceca0580ce65416546be65ffbb7eddae7dcf297af.md","digest":"sha256:1675f8855b6b9a2b7b0b64bceca0580ce65416546be65ffbb7eddae7dcf297af","bytes":69175}}}
